{"release_schema_version":"1.0","release_id":"rel-phebs.protobuf.wire.buf-1.0.2","release_version":"1.0.2","pack_id":"phebs.protobuf.wire.buf","pack_claim_version":"1.0.2","card":{"artifact_id":"wire-buf-card-1.0.2.md","digest":"sha256:cd7d96b5d11a8595999584096dd8fa7be13d8d6189d9db32c543e834396bb5d5"},"manifest":{"artifact_id":"wire-buf-manifest-1.0.2.json","digest":"sha256:3be771ce5bf1b563c563a44aa733d272d581c69f6fe29c3ac6a9c1a755fdc448"},"implementation":{"phebs_source_commit":"758036415c61f22a9d295e586f4a3c8a1b2715b1","phebs_binary_digest":"sha256:e6987616fd6780ccb2c62d650bbd91c37a63c293b9d223e37bce3a72ec8e40aa","pack_implementation_digest":"sha256:be4f3c79740557dacedf6a845ffb2fc221098a39f701d880126efcf7e755b145","toolchain_digest":"sha256:c6652a655b5c51d1ce66b001a3f82f118b97fecfca54705e3b7313d6c8b82dba"},"referenced_artifacts_root_digest":"sha256:ec3131f574631f59ab0bbc2e03b5389c1bda1ff580f968e2f1d823574a179057","validation":{"artifact_id":"wire-buf-validation-1.0.2.json","digest":"sha256:3e1e58e987cce3b42412b1c4fc46e144082c293debc0adf4d86214eb6a6c86cb","applies":true,"expires_at":"2027-01-10T23:59:59Z","expiry_trigger":null},"derived_status":"released","approved_at":"2026-10-14T22:58:44Z","approval_records":["ben-meddeb-2026-10-14-linux-track-atlas-mcp"],"canonicalization":{"algorithm":"phebs-canonical-json","version":"1"},"signature":{"key_id":"ben-phebs-release-2026-10","algorithm":"ed25519","value":"Vw6j7n3R94cjsVoFxG4Oe4EsGTa9uoO7Ds1dxCa6mdKm4iYZ4N2I27TNGwiO4yZ6dfFHuurTrIbyPuvTWd9nBQ=="}}
