{"release_schema_version":"1.0","release_id":"rel-phebs.thrift.contract-1.0.2","release_version":"1.0.2","pack_id":"phebs.thrift.contract","pack_claim_version":"1.0.2","card":{"artifact_id":"thrift-contract-card-1.0.2.md","digest":"sha256:dddbb3f58acc99880019bd3ee845c732091f60d888579327f0f1fadfbc189193"},"manifest":{"artifact_id":"thrift-contract-manifest-1.0.2.json","digest":"sha256:eb09bcde73e634383e1eeaae5ac6e7f1af5eb668e5eb7f23522f3c680331954b"},"implementation":{"phebs_source_commit":"290e1518a4a192d0a3494c3ed9fa2eb39a450355","phebs_binary_digest":"sha256:7993fa98493b6a5e6e5f5dc1d7762dcee7be7a65c0f8246d7524a8064b50e582","pack_implementation_digest":"sha256:bb2dcc25ff017afb98aeba3adbf2596f5bcd64efaf6a4602b7e937c66413c4ea","toolchain_digest":"sha256:c6652a655b5c51d1ce66b001a3f82f118b97fecfca54705e3b7313d6c8b82dba"},"referenced_artifacts_root_digest":"sha256:5d95ee9fcc1f8e53330e4eb26f1fb291b5583db841033530d410920240a365f8","validation":{"artifact_id":"thrift-contract-validation-1.0.2.json","digest":"sha256:b997779a72114e218eb6a4bb5838217ccefc3d528c12c39a922768d20569f359","applies":true,"expires_at":"2027-01-12T23:59:59Z","expiry_trigger":null},"derived_status":"released","approved_at":"2026-10-20T00:00:00Z","approval_records":["ben-meddeb-2026-10-14-linux-track-atlas-mcp","ben-meddeb-2026-10-20-exact-binary-rebinding-no-claim-expansion"],"canonicalization":{"algorithm":"phebs-canonical-json","version":"1"},"signature":{"key_id":"ben-phebs-release-2026-10","algorithm":"ed25519","value":"mTpzm8X2QOQ6rSt2DBzHWmcYWK1dHQa2ClZTKYJQHDq++PMhz8leciL+HpPEdBQqKc4R6f/01zxaTkZsJIxBAQ=="}}
