{"release_schema_version":"1.0","release_id":"rel-phebs.kafka.producer-1.0.1","release_version":"1.0.1","pack_id":"phebs.kafka.producer","pack_claim_version":"1.0.1","card":{"artifact_id":"kafka-producer-card-1.0.1.md","digest":"sha256:398f2a6d04b29b2575918c45880588ecef5bb8897b7decd3f874d5674a1bc095"},"manifest":{"artifact_id":"kafka-producer-manifest-1.0.1.json","digest":"sha256:3932f934cc9591dfd627d874466ceec6283ae934f99229d830e00cbe6cc9fea5"},"implementation":{"phebs_source_commit":"41da6187d6a7bea46864925d9ecd4d456555a265","phebs_binary_digest":"sha256:9dc0ad09440f40b6fcb8b3b9490a7479ab4b8f1b593b466a7c61a85c1420e2ff","pack_implementation_digest":"sha256:cc47e878f24af3fdf8bb58f1ae43fd0c02aa6b60968b8eeb5798abd141cbd9db","toolchain_digest":"sha256:c6652a655b5c51d1ce66b001a3f82f118b97fecfca54705e3b7313d6c8b82dba"},"referenced_artifacts_root_digest":"sha256:ae01f92aed31f361e58e7b4d4947ae830915fca817a93ba6e0aca3bb76216736","validation":{"artifact_id":"kafka-producer-validation-1.0.1.json","digest":"sha256:5deee044fc9b7171ac60c1af2444da5e1e4c56e9be51f29bd73405b55c866833","applies":true,"expires_at":"2027-01-11T23:59:59Z","expiry_trigger":null},"derived_status":"released","approved_at":"2026-10-13T01:52:13Z","approval_records":["ben-meddeb-2026-10-13-proceed-instruction"],"canonicalization":{"algorithm":"phebs-canonical-json","version":"1"},"signature":{"key_id":"ben-phebs-release-2026-10","algorithm":"ed25519","value":"0PDzshFmEtcsPbWTatF9Dm14FoINpKo8Y2N5wD1ruX2E30ynEu3QzdXYj/fkMtasF7EbwZA7u8/ezKyQ3xSaCQ=="}}
